{
  "schema": "kxm.run-event.v1",
  "eventId": "evt_01JRESULT00000000000000000",
  "eventType": "assignment.result_recorded",
  "projectId": "prj_01JPROJECT00000000000000000",
  "runId": "run_01JRUN00000000000000000000",
  "homeRuntimeId": "runtime_01JRUNTIME000000000000000",
  "sequence": 24,
  "commandId": "cmd_01JRESULTCOMMAND0000000000",
  "occurredAt": "2026-09-01T22:12:10.000Z",
  "recordedAt": "2026-09-01T22:12:10.003Z",
  "monotonicNs": "6112234000000",
  "configRevision": "sha256:1111111111111111111111111111111111111111111111111111111111111111",
  "memoryRevision": "ctxrev_01JMEMORY0000000000000000",
  "executorPolicyRevision": "sha256:8888888888888888888888888888888888888888888888888888888888888888",
  "toolPolicyRevision": "sha256:9999999999999999999999999999999999999999999999999999999999999999",
  "payload": {
    "workflowId": "fix",
    "status": "result_recorded",
    "outcome": "implemented",
    "summary": "Added single-flight token refresh and regression coverage.",
    "stepId": "implement",
    "stepAttempt": 1,
    "assignmentId": "assignment_01JASSIGNMENT00000000000",
    "attemptId": "attempt_01JATTEMPT0000000000000",
    "agentId": "implementer",
    "instanceNo": 1,
    "scopeEpoch": 1,
    "executor": {
      "id": "local",
      "kind": "local",
      "executorVersion": "1.0.0",
      "harness": "pi",
      "harnessVersion": "0.84.4"
    },
    "model": {
      "profile": "implementation",
      "provider": "anthropic",
      "model": "claude-sonnet-4-6",
      "tags": ["implementation"]
    },
    "evidenceRefs": [
      {
        "id": "evidence_01JEVIDENCE000000000000",
        "kind": "test-result",
        "hash": "sha256:5555555555555555555555555555555555555555555555555555555555555555",
        "status": "passed"
      }
    ],
    "timing": {
      "durationMs": 730000,
      "agentMs": 730000
    },
    "usage": {
      "inputTokens": 18200,
      "outputTokens": 3400,
      "cost": 1.42,
      "currency": "USD",
      "costKind": "estimated"
    }
  }
}
